{
  "$schema": "https://open-design.ai/schemas/plugin.v1.json",
  "specVersion": "1.0.0",
  "name": "example-guizang-ppt",
  "title": "Guizang Ppt",
  "title_i18n": {
    "zh-CN": "Guizang Ppt",
    "zh-TW": "Guizang Ppt",
    "ja": "Guizang Ppt",
    "ko": "Guizang Ppt",
    "de": "Guizang Ppt",
    "fr": "Guizang Ppt",
    "ru": "Guizang Ppt",
    "es": "Guizang Ppt",
    "pt-BR": "Guizang Ppt",
    "it": "Guizang Ppt",
    "vi": "Guizang Ppt",
    "pl": "Guizang Ppt",
    "id": "Guizang Ppt",
    "nl": "Guizang Ppt",
    "ar": "Guizang Ppt",
    "tr": "Guizang Ppt",
    "uk": "Guizang Ppt",
    "en": "Guizang Ppt"
  },
  "version": "0.1.0",
  "description": "生成\"电子杂志 × 电子墨水\"风格的横向翻页网页 PPT（单 HTML 文件），含 WebGL 流体背景、衬线标题 + 非衬线正文、章节幕封、数据大字报、图片网格等模板。当用户需要制作分享 / 演讲 / 发布会风格的网页 PPT，或提到\"杂志风 PPT\"、\"horizontal swipe deck\"、\"editorial magazine\"、\"e-ink presentation\"时使用。",
  "description_i18n": {
    "zh-CN": "生成「电子杂志 × 电子墨水」风格的横向翻页网页 PPT（单 HTML 文件），含 WebGL 流体背景、衬线标题 + 非衬线正文、章节幕封、数据大字报、图片网格等模板。适用于制作分享、演讲、发布会风格的网页 PPT，或杂志风演示文稿。",
    "zh-TW": "生成「電子雜誌 × 電子墨水」風格的橫向翻頁網頁 PPT（單一 HTML 檔案），含 WebGL 流體背景、襯線標題 + 非襯線正文、章節幕封、數據大字報、圖片網格等模板。適用於製作分享、演講、發表會風格的網頁 PPT，或雜誌風簡報。",
    "ja": "電子雑誌 × 電子インク風の横スワイプ Web プレゼンテーション（単一 HTML ファイル）を生成。WebGL 流体背景、セリフ見出し + サンセリフ本文、章扉、データビジュアル、画像グリッドなどのテンプレートを搭載。雑誌風プレゼンや発表会向け。",
    "ko": "전자 잡지 × 전자 잉크 스타일의 가로 스와이프 웹 프레젠테이션(단일 HTML 파일)을 생성합니다. WebGL 유체 배경, 세리프 제목 + 산세리프 본문, 챕터 표지, 데이터 시각화, 이미지 그리드 등의 템플릿을 포함하며 잡지풍 발표 자료 제작에 적합합니다.",
    "de": "Erstellt horizontale Swipe-Web-Präsentationen im Magazin- und E-Ink-Stil (einzelne HTML-Datei) mit WebGL-Fluid-Hintergrund, Serifen-Titeln, serifenlosen Texten, Kapitelteilern, Datenvisualisierungen und Bildrastern für Vorträge und Produktvorstellungen.",
    "fr": "Génère des présentations web à défilement horizontal au style magazine et encre électronique (fichier HTML unique) avec arrière-plan fluide WebGL, titres à empattements, texte sans empattements, séparateurs de chapitres, visualisations de données et grilles d'images pour présentations et conférences.",
    "ru": "Создаёт горизонтальные веб-презентации в стиле электронного журнала и e-ink (один HTML-файл) с WebGL-фоном, заголовками с засечками, текстом без засечек, разделителями глав, визуализацией данных и сетками изображений для выступлений и релизов.",
    "es": "Genera presentaciones web de deslizamiento horizontal al estilo revista y tinta electrónica (archivo HTML único) con fondo fluido WebGL, títulos serif, texto sans-serif, separadores de capítulos, visualizaciones de datos y cuadrículas de imágenes para charlas y lanzamientos.",
    "pt-BR": "Gera apresentações web de deslize horizontal em estilo revista e tinta eletrônica (arquivo HTML único) com fundo fluido WebGL, títulos serifados, texto sem serifa, divisórias de capítulos, visualizações de dados e grades de imagens para palestras e lançamentos.",
    "it": "Genera presentazioni web a scorrimento orizzontale in stile rivista e inchiostro elettronico (file HTML singolo) con sfondo fluido WebGL, titoli serif, testo sans-serif, separatori di capitoli, visualizzazioni dati e griglie di immagini per presentazioni e conferenze.",
    "vi": "Tạo bản trình bày web vuốt ngang phong cách tạp chí điện tử và mực điện tử (file HTML đơn) với nền chất lỏng WebGL, tiêu đề serif, nội dung sans-serif, trang chương, biểu đồ dữ liệu và lưới hình ảnh cho thuyết trình và ra mắt sản phẩm.",
    "pl": "Tworzy poziome prezentacje webowe w stylu magazynu i e-ink (jeden plik HTML) z płynnym tłem WebGL, tytułami szeryfowymi, tekstem bezszeryfowym, stronami rozdziałów, wizualizacjami danych i siatkami obrazów do prezentacji i konferencji.",
    "id": "Membuat presentasi web geser horizontal bergaya majalah dan tinta elektronik (file HTML tunggal) dengan latar belakang cairan WebGL, judul serif, teks sans-serif, pembatas bab, visualisasi data, dan grid gambar untuk presentasi dan peluncuran produk.",
    "nl": "Maakt horizontale swipe-webpresentaties in magazine- en e-inktstijl (enkel HTML-bestand) met WebGL-vloeibare achtergrond, schreeftitels, schreefloze tekst, hoofdstukscheidingen, datavisualisaties en afbeeldingsrasters voor presentaties en lanceringen.",
    "ar": "ينشئ عروض تقديمية ويب أفقية التمرير بأسلوب المجلة والحبر الإلكتروني (ملف HTML واحد) مع خلفية سائلة WebGL وعناوين serif ونصوص sans-serif وفواصل فصول وتصورات بيانات وشبكات صور للعروض والإطلاقات.",
    "tr": "Dergi ve e-mürekkep stilinde yatay kaydırmalı web sunumları (tek HTML dosyası) oluşturur. WebGL akışkan arka plan, serifli başlıklar, serifsiz metin, bölüm ayırıcıları, veri görselleştirmeleri ve resim ızgaraları ile konuşmalar ve lansmanlar için uygundur.",
    "uk": "Створює горизонтальні веб-презентації в стилі журналу та електронного чорнила (один HTML-файл) з WebGL-фоном, заголовками з зарубками, текстом без зарубок, розділювачами розділів, візуалізаціями даних та сітками зображень для виступів і презентацій.",
    "en": "生成\"电子杂志 × 电子墨水\"风格的横向翻页网页 PPT（单 HTML 文件），含 WebGL 流体背景、衬线标题 + 非衬线正文、章节幕封、数据大字报、图片网格等模板。当用户需要制作分享 / 演讲 / 发布会风格的网页 PPT，或提到\"杂志风 PPT\"、\"horizontal swipe deck\"、\"editorial magazine\"、\"e-ink presentation\"时使用。"
  },
  "license": "MIT",
  "author": {
    "name": "Open Design",
    "url": "https://github.com/nexu-io"
  },
  "homepage": "https://github.com/nexu-io/open-design/tree/main/plugins/_official/examples/guizang-ppt",
  "tags": [
    "example",
    "first-party",
    "deck",
    "marketing",
    "web",
    "ppt",
    "slides",
    "presentation",
    "magazine",
    "untitled",
    "horizontal-swipe",
    "horizontal-swipe-deck",
    "editorial-magazine",
    "e-ink-presentation"
  ],
  "compat": {
    "agentSkills": [
      {
        "path": "./SKILL.md"
      }
    ]
  },
  "od": {
    "kind": "scenario",
    "taskKind": "new-generation",
    "mode": "deck",
    "scenario": "marketing",
    "surface": "web",
    "preview": {
      "type": "html",
      "entry": "./index.html"
    },
    "useCase": {
      "query": {
        "en": "Create a magazine-style PPT about 'One-person companies: organizations folded by AI' for a 25-minute talk aimed at designers and founders. First recommend one direction for me to choose from: Monocle, WIRED, Kinfolk, Domus, or Lab.",
        "zh-CN": "帮我做一份杂志风的 PPT —— 关于'一人公司 · 被 AI 折叠的组织'，25 分钟分享会，目标受众是设计师 + 创业者。先推荐一个方向（Monocle / WIRED / Kinfolk / Domus / Lab）让我选。"
      }
    },
    "context": {
      "skills": [
        {
          "path": "./SKILL.md"
        }
      ],
      "assets": [
        "./assets/example-slides.html",
        "./assets/template.html",
        "./references/checklist.md",
        "./references/components.md",
        "./references/layouts.md",
        "./references/styles.md",
        "./references/themes.md"
      ]
    },
    "pipeline": {
      "stages": [
        {
          "id": "generate",
          "atoms": [
            "file-write"
          ]
        }
      ]
    },
    "capabilities": [
      "prompt:inject",
      "fs:write"
    ]
  }
}
