{
  "$schema": "https://open-design.ai/schemas/plugin.v1.json",
  "specVersion": "1.0.0",
  "name": "design-system-publication",
  "title": "Publication",
  "title_i18n": {
    "zh-CN": "出版物",
    "zh-TW": "出版物",
    "ja": "パブリケーション",
    "ko": "출판물",
    "de": "Publikation",
    "fr": "Publication",
    "ru": "Публикация",
    "es": "Publicación",
    "pt-BR": "Publicação",
    "it": "Pubblicazione",
    "vi": "Ấn phẩm",
    "pl": "Publikacja",
    "id": "Publikasi",
    "nl": "Publicatie",
    "ar": "النشر",
    "tr": "Yayın",
    "uk": "Публікація",
    "en": "Publication"
  },
  "version": "0.1.0",
  "description": "Print-inspired visual language for books, magazines, and reports with editorial grids and expressive typography.",
  "description_i18n": {
    "zh-CN": "适用于书籍、杂志和报告的印刷风格视觉语言，具有编辑网格和富有表现力的排版。",
    "zh-TW": "適用於書籍、雜誌和報告的印刷風格視覺語言，具有編輯網格和富有表現力的排版。",
    "ja": "書籍、雑誌、レポート向けの印刷物にインスパイアされたビジュアル言語。エディトリアルグリッドと表現力豊かなタイポグラフィを備えています。",
    "ko": "책, 잡지, 보고서를 위한 인쇄물에서 영감을 받은 비주얼 언어로 편집 그리드와 표현력 있는 타이포그래피를 제공합니다.",
    "de": "Druckinspirierte visuelle Sprache für Bücher, Zeitschriften und Berichte mit redaktionellen Rastern und ausdrucksstarker Typografie.",
    "fr": "Langage visuel inspiré de l'imprimé pour les livres, magazines et rapports avec des grilles éditoriales et une typographie expressive.",
    "ru": "Визуальный язык в стиле печати для книг, журналов и отчётов с редакционными сетками и выразительной типографикой.",
    "es": "Lenguaje visual inspirado en la impresión para libros, revistas e informes con cuadrículas editoriales y tipografía expresiva.",
    "pt-BR": "Linguagem visual inspirada em impressão para livros, revistas e relatórios com grades editoriais e tipografia expressiva.",
    "it": "Linguaggio visivo ispirato alla stampa per libri, riviste e report con griglie editoriali e tipografia espressiva.",
    "vi": "Ngôn ngữ thị giác lấy cảm hứng từ in ấn cho sách, tạp chí và báo cáo với lưới biên tập và kiểu chữ biểu cảm.",
    "pl": "Język wizualny inspirowany drukiem dla książek, czasopism i raportów z siatkami redakcyjnymi i ekspresyjną typografią.",
    "id": "Bahasa visual terinspirasi cetak untuk buku, majalah, dan laporan dengan grid editorial dan tipografi ekspresif.",
    "nl": "Aan drukwerk ontleende visuele taal voor boeken, tijdschriften en rapporten met redactionele rasters en expressieve typografie.",
    "ar": "لغة بصرية مستوحاة من الطباعة للكتب والمجلات والتقارير مع شبكات تحريرية وطباعة معبرة.",
    "tr": "Kitaplar, dergiler ve raporlar için editoryal ızgaralar ve etkileyici tipografi içeren baskıdan ilham alan görsel dil.",
    "uk": "Візуальна мова в стилі друку для книг, журналів та звітів з редакційними сітками та виразною типографікою.",
    "en": "Print-inspired visual language for books, magazines, and reports with editorial grids and expressive typography."
  },
  "license": "MIT",
  "tags": [
    "design-system",
    "first-party",
    "design",
    "creative-artistic"
  ],
  "od": {
    "kind": "scenario",
    "taskKind": "new-generation",
    "mode": "design-system",
    "scenario": "design",
    "surface": "web",
    "useCase": {
      "query": {
        "en": "Generate a {{artifactKind}} using the Publication design system. Stay faithful to its colour palette, typography, spacing, iconography, and component vocabulary as documented in DESIGN.md.",
        "zh-CN": "使用这个插件完成以下任务：Generate a {{artifactKind}} using the Publication design system. Stay faithful to its colour palette, typography, spacing, iconography, and component vocabulary as documented in DESIGN.md."
      }
    },
    "inputs": [
      {
        "name": "artifactKind",
        "label": "Artifact kind",
        "type": "select",
        "options": [
          "landing page",
          "dashboard",
          "marketing site",
          "app screen"
        ],
        "default": "landing page"
      },
      {
        "name": "brief",
        "label": "Brief",
        "type": "text",
        "placeholder": "What should the page communicate?"
      }
    ],
    "context": {
      "designSystem": {
        "ref": "publication",
        "primary": true
      },
      "assets": [
        "./DESIGN.md"
      ]
    },
    "pipeline": {
      "stages": [
        {
          "id": "generate",
          "atoms": [
            "file-write"
          ]
        }
      ]
    },
    "capabilities": [
      "prompt:inject",
      "fs:write"
    ]
  }
}
