{
  "$schema": "https://open-design.ai/schemas/plugin.v1.json",
  "specVersion": "1.0.0",
  "name": "example-last30days",
  "title": "Last30days",
  "title_i18n": {
    "zh-CN": "最近30天",
    "zh-TW": "最近30天",
    "ja": "過去30日間",
    "ko": "최근 30일",
    "de": "Letzte 30 Tage",
    "fr": "30 derniers jours",
    "ru": "Последние 30 дней",
    "es": "Últimos 30 días",
    "pt-BR": "Últimos 30 dias",
    "it": "Ultimi 30 giorni",
    "vi": "30 ngày qua",
    "pl": "Ostatnie 30 dni",
    "id": "30 Hari Terakhir",
    "nl": "Laatste 30 dagen",
    "ar": "آخر 30 يومًا",
    "tr": "Son 30 Gün",
    "uk": "Останні 30 днів",
    "en": "Last30days"
  },
  "version": "0.1.0",
  "description": "Recent community and social trend research over the last 30 days. Use when\nthe brief asks what people are saying now, recent sentiment, community\nreactions, social proof, launch reaction, trend scan, or last-30-days context.",
  "description_i18n": {
    "zh-CN": "最近30天的社区和社交趋势研究。适用于了解当前舆论、近期情绪、社区反应、社交证明、发布反馈、趋势扫描或最近30天的背景信息。",
    "zh-TW": "最近30天的社群和社交趨勢研究。適用於了解當前輿論、近期情緒、社群反應、社交證明、發布反饋、趨勢掃描或最近30天的背景資訊。",
    "ja": "過去30日間のコミュニティとソーシャルトレンド調査。現在の意見、最近の感情、コミュニティの反応、ソーシャルプルーフ、ローンチ反応、トレンドスキャン、または過去30日間のコンテキストに関する問い合わせに使用します。",
    "ko": "최근 30일간의 커뮤니티 및 소셜 트렌드 조사. 현재 여론, 최근 감정, 커뮤니티 반응, 소셜 증명, 출시 반응, 트렌드 스캔 또는 최근 30일 맥락에 대한 질문에 사용합니다.",
    "de": "Community- und Social-Trend-Recherche der letzten 30 Tage. Verwenden Sie dies für aktuelle Meinungen, jüngste Stimmungen, Community-Reaktionen, Social Proof, Launch-Feedback, Trend-Scans oder Kontext der letzten 30 Tage.",
    "fr": "Recherche sur les tendances communautaires et sociales des 30 derniers jours. À utiliser pour connaître l'opinion actuelle, le sentiment récent, les réactions de la communauté, la preuve sociale, la réaction au lancement, l'analyse des tendances ou le contexte des 30 derniers jours.",
    "ru": "Исследование социальных трендов и мнений сообщества за последние 30 дней. Используйте для анализа текущих высказываний, настроений, реакций сообщества, социальных доказательств, откликов на запуск, сканирования трендов или контекста последних 30 дней.",
    "es": "Investigación de tendencias comunitarias y sociales de los últimos 30 días. Úselo para conocer la opinión actual, el sentimiento reciente, las reacciones de la comunidad, la prueba social, la reacción al lanzamiento, el escaneo de tendencias o el contexto de los últimos 30 días.",
    "pt-BR": "Pesquisa de tendências comunitárias e sociais dos últimos 30 dias. Use para saber o que as pessoas estão dizendo agora, sentimento recente, reações da comunidade, prova social, reação ao lançamento, varredura de tendências ou contexto dos últimos 30 dias.",
    "it": "Ricerca sulle tendenze della comunità e sui social degli ultimi 30 giorni. Da utilizzare per conoscere le opinioni attuali, il sentiment recente, le reazioni della comunità, la prova sociale, la reazione al lancio, la scansione delle tendenze o il contesto degli ultimi 30 giorni.",
    "vi": "Nghiên cứu xu hướng cộng đồng và mạng xã hội trong 30 ngày qua. Sử dụng khi cần biết ý kiến hiện tại, cảm xúc gần đây, phản ứng cộng đồng, bằng chứng xã hội, phản hồi ra mắt, quét xu hướng hoặc bối cảnh 30 ngày qua.",
    "pl": "Badanie trendów społecznościowych i社交nych z ostatnich 30 dni. Użyj, gdy potrzebujesz informacji o aktualnych opiniach, nastrojach, reakcjach społeczności, dowodach społecznych, reakcji na premierę, skanowaniu trendów lub kontekście z ostatnich 30 dni.",
    "id": "Riset tren komunitas dan sosial selama 30 hari terakhir. Gunakan untuk mengetahui pendapat terkini, sentimen terbaru, reaksi komunitas, bukti sosial, respons peluncuran, pemindaian tren, atau konteks 30 hari terakhir.",
    "nl": "Onderzoek naar community- en sociale trends van de afgelopen 30 dagen. Gebruik wanneer u wilt weten wat mensen nu zeggen, recent sentiment, reacties van de community, sociaal bewijs, lanceringsreacties, trendscan of context van de laatste 30 dagen.",
    "ar": "بحث اتجاهات المجتمع ووسائل التواصل الاجتماعي خلال الـ 30 يومًا الماضية. استخدمه لمعرفة ما يقوله الناس الآن، والمشاعر الحديثة، وردود فعل المجتمع، والدليل الاجتماعي، وردود الفعل على الإطلاق، ومسح الاتجاهات، أو سياق الـ 30 يومًا الماضية.",
    "tr": "Son 30 günün topluluk ve sosyal trend araştırması. İnsanların şu anda ne söylediğini, son duyguları, topluluk tepkilerini, sosyal kanıtı, lansman tepkisini, trend taramasını veya son 30 günün bağlamını öğrenmek için kullanın.",
    "uk": "Дослідження трендів спільноти та соцмереж за останні 30 днів. Використовуйте для аналізу поточної думки, нещодавніх настроїв, реакцій спільноти, соціальних доказів, відгуків на запуск, сканування трендів або контексту останніх 30 днів.",
    "en": "Recent community and social trend research over the last 30 days. Use when\nthe brief asks what people are saying now, recent sentiment, community\nreactions, social proof, launch reaction, trend scan, or last-30-days context."
  },
  "license": "MIT",
  "author": {
    "name": "Open Design",
    "url": "https://github.com/nexu-io"
  },
  "homepage": "https://github.com/nexu-io/open-design/tree/main/plugins/_official/examples/last30days",
  "tags": [
    "example",
    "first-party",
    "prototype",
    "design",
    "web",
    "last-30-days",
    "last30days",
    "recent-sentiment",
    "community-reaction",
    "what-people-are-saying",
    "trend-scan",
    "social-research",
    "30",
    "untitled"
  ],
  "compat": {
    "agentSkills": [
      {
        "path": "./SKILL.md"
      }
    ]
  },
  "od": {
    "kind": "scenario",
    "taskKind": "new-generation",
    "mode": "prototype",
    "scenario": "design",
    "surface": "web",
    "preview": {
      "type": "markdown",
      "entry": "./example.html"
    },
    "useCase": {
      "query": {
        "en": "Recent community and social trend research over the last 30 days. Use when the brief asks what people are saying now, recent sentiment, community reactions, social proof, launch reaction, trend scan, or last-30-days context.",
        "zh-CN": "使用这个插件完成以下任务：Recent community and social trend research over the last 30 days. Use when the brief asks what people are saying now, recent sentiment, community reactions, social proof, launch reaction, trend scan, or last-30-days context."
      }
    },
    "context": {
      "skills": [
        {
          "path": "./SKILL.md"
        }
      ],
      "designSystem": {
        "primary": true
      },
      "assets": [
        "./references/save-html-brief.md"
      ]
    },
    "pipeline": {
      "stages": [
        {
          "id": "generate",
          "atoms": [
            "file-write"
          ]
        }
      ]
    },
    "capabilities": [
      "prompt:inject",
      "fs:write"
    ]
  }
}
